{
  "$schema": "https://french-language-coach.github.io/schemas/grammar_lesson.json",
  "id": "present-tense-irregular",
  "title": "Present Tense: Irregular Verbs",
  "topic": "Verb Tenses",
  "difficulty": "beginner",
  "sections": [
    {
      "title": "Introduction to Irregular Verbs",
      "content": "Some French verbs do not follow regular conjugation patterns and must be memorized individually. The most important irregular verbs are être (to be), avoir (to have), aller (to go), and faire (to do/make).",
      "examples": [
        "Être, avoir, aller, and faire are the four essential irregular verbs",
        "These verbs appear frequently in everyday French"
      ]
    },
    {
      "title": "Être (To Be)",
      "content": "The verb être is one of the most important verbs in French. Its conjugation is: je suis, tu es, il/elle/on est, nous sommes, vous êtes, ils/elles sont.",
      "examples": [
        "Je suis étudiant (I am a student)",
        "Tu es très gentille (You are very kind)",
        "Il est grand (He is tall)",
        "Nous sommes prêts (We are ready)",
        "Vous êtes à l'heure (You are on time)",
        "Elles sont fatiguées (They are tired)"
      ]
    },
    {
      "title": "Avoir (To Have)",
      "content": "Avoir is used to express possession and in many idiomatic expressions. Conjugation: j'ai, tu as, il/elle/on a, nous avons, vous avez, ils/elles ont.",
      "examples": [
        "J'ai un livre (I have a book)",
        "Tu as raison (You are right)",
        "Il a 25 ans (He is 25 years old)",
        "Nous avons faim (We are hungry)",
        "Vous avez soif (You are thirsty)",
        "Ils ont peur (They are afraid)"
      ]
    },
    {
      "title": "Aller (To Go)",
      "content": "Aller is used for movement and in the near future construction. Conjugation: je vais, tu vas, il/elle/on va, nous allons, vous allez, ils/elles vont.",
      "examples": [
        "Je vais au marché (I go to the market)",
        "Tu vas bien? (Are you okay?)",
        "Il va à Paris (He goes to Paris)",
        "Nous allons au cinéma (We go to the cinema)",
        "Vous allez trop vite (You go too fast)",
        "Elles vont à l'école (They go to school)"
      ]
    },
    {
      "title": "Faire (To Do/Make)",
      "content": "Faire is used for actions and activities. Conjugation: je fais, tu fais, il/elle/on fait, nous faisons, vous faites, ils/elles font.",
      "examples": [
        "Je fais mes devoirs (I do my homework)",
        "Tu fais du sport (You do sports)",
        "Il fait beau (The weather is nice)",
        "Nous faisons un gâteau (We make a cake)",
        "Vous faites un bon travail (You do a good job)",
        "Ils font la fête (They party)"
      ]
    },
    {
      "title": "Other Common Irregular Verbs",
      "content": "Other frequently used irregular verbs include: prendre (to take), venir (to come), voir (to see), pouvoir (to be able to), vouloir (to want), savoir (to know).",
      "examples": [
        "Je prends, tu prends, il prend, nous prenons, vous prenez, ils prennent",
        "Je viens, tu viens, il vient, nous venons, vous venez, ils viennent",
        "Je vois, tu vois, il voit, nous voyons, vous voyez, ils voient"
      ]
    },
    {
      "title": "Practice Exercise",
      "content": "Conjugate these irregular verbs: être, avoir, aller, faire, prendre, venir. Write a short paragraph using at least 5 different irregular verbs in the present tense."
    }
  ]
}
