{
  "$schema": "https://french-language-coach.github.io/schemas/grammar_lesson.json",
  "id": "imperative",
  "title": "Imperative Mood",
  "topic": "Moods",
  "difficulty": "beginner",
  "sections": [
    {
      "title": "Introduction to Imperative",
      "content": "The imperative mood is used to give commands, instructions, or orders. It corresponds to the imperative in English (e.g., Go! Speak! Listen!). In French, the imperative exists for the tu, nous, and vous forms.",
      "examples": [
        "Parle! (Speak!)",
        "Mangeons! (Let's eat!)",
        "Attendez! (Wait!)"
      ]
    },
    {
      "title": "Formation for Regular Verbs",
      "content": "For regular verbs, the imperative is formed from the present tense conjugation. For -ER verbs, the tu form drops the -s. The nous and vous forms are the same as the present tense.",
      "examples": [
        "Parler: parle! (speak! - tu), parlons! (let's speak! - nous), parlez! (speak! - vous)",
        "Finir: finis! (finish! - tu), finissons! (let's finish! - nous), finissez! (finish! - vous)",
        "Vendre: vends! (sell! - tu), vendons! (let's sell! - nous), vendez! (sell! - vous)"
      ]
    },
    {
      "title": "Formation for Irregular Verbs",
      "content": "Irregular verbs have irregular imperative forms. The most common are être, avoir, aller, and faire.",
      "examples": [
        "Être: sois! (be! - tu), soyons! (let's be! - nous), soyez! (be! - vous)",
        "Avoir: aie! (have! - tu), ayons! (let's have! - nous), ayez! (have! - vous)",
        "Aller: va! (go! - tu), allons! (let's go! - nous), allez! (go! - vous)",
        "Faire: fais! (do/make! - tu), faisons! (let's do/make! - nous), faites! (do/make! - vous)"
      ]
    },
    {
      "title": "Affirmative vs Negative Imperative",
      "content": "In affirmative commands, the object pronouns come AFTER the verb and are connected with hyphens. In negative commands, the object pronouns come BEFORE the verb, like in regular sentences.",
      "examples": [
        "Affirmative: Regarde-le! (Look at it!)",
        "Negative: Ne le regarde pas! (Don't look at it!)",
        "Affirmative: Écoute-moi! (Listen to me!)",
        "Negative: Ne m'écoute pas! (Don't listen to me!)",
        "Affirmative: Mangeons-la! (Let's eat it!)",
        "Negative: Ne la mangeons pas! (Let's not eat it!)"
      ]
    },
    {
      "title": "Imperative with Reflexive Verbs",
      "content": "With reflexive verbs, the reflexive pronoun comes after the verb in affirmative commands, but before the verb in negative commands.",
      "examples": [
        "Affirmative: Lève-toi! (Get up!)",
        "Negative: Ne te lève pas! (Don't get up!)",
        "Affirmative: Asseyons-nous! (Let's sit down!)",
        "Negative: Ne nous asseyons pas! (Let's not sit down!)",
        "Affirmative: Habillez-vous! (Get dressed!)",
        "Negative: Ne vous habillez pas! (Don't get dressed!)"
      ]
    },
    {
      "title": "Common Imperative Expressions",
      "content": "Many common phrases use the imperative mood.",
      "examples": [
        "Attention! (Be careful! / Attention!)",
        "Écoute! (Listen!)",
        "Regarde! (Look!)",
        "Viens ici! (Come here!)",
        "Partez! (Leave!)",
        "Attends! (Wait!)",
        "Fais attention! (Be careful!)"
      ]
    },
    {
      "title": "Polite Imperative with Vous",
      "content": "The vous form of the imperative is used for formal commands or when addressing multiple people. It's the same as the present tense vous form.",
      "examples": [
        "Parlez plus fort! (Speak louder!)",
        "Attendez ici! (Wait here!)",
        "Asseyez-vous, s'il vous plaît! (Please sit down!)",
        "Ne partez pas! (Don't leave!)",
        "Veuillez entrer (Please come in) - very formal"
      ]
    },
    {
      "title": "Practice Exercise",
      "content": "Write 10 commands using the imperative mood: 1) Tell someone to speak. 2) Tell someone to eat. 3) Tell a group to listen. 4) Tell someone not to go. 5) Tell someone to sit down. 6) Tell a group to be quiet. 7) Tell someone to wait. 8) Tell someone to come here."
    }
  ]
}
