{
  "$schema": "https://french-language-coach.github.io/schemas/grammar_lesson.json",
  "id": "articles",
  "title": "French Articles",
  "topic": "Nouns and Adjectives",
  "difficulty": "beginner",
  "sections": [
    {
      "title": "Introduction to Articles",
      "content": "Articles are words that precede nouns to indicate their gender and number. French has definite articles (the), indefinite articles (a/an), and partitive articles (some/any).",
      "examples": [
        "le livre (the book) - definite",
        "un livre (a book) - indefinite",
        "du pain (some bread) - partitive"
      ]
    },
    {
      "title": "Definite Articles",
      "content": "Definite articles (le, la, l', les) refer to specific nouns that have already been mentioned or are known to the speaker and listener. Le for masculine singular, la for feminine singular, l' for singular nouns starting with a vowel, les for plural.",
      "examples": [
        "le chat (the cat) - masculine singular",
        "la table (the table) - feminine singular",
        "l'arbre (the tree) - masculine singular starting with vowel",
        "l'école (the school) - feminine singular starting with vowel",
        "les chats (the cats) - plural",
        "les tables (the tables) - plural"
      ]
    },
    {
      "title": "Indefinite Articles",
      "content": "Indefinite articles (un, une, des) refer to non-specific nouns. Un for masculine singular, une for feminine singular, des for plural.",
      "examples": [
        "un livre (a book) - masculine",
        "une pomme (an apple) - feminine",
        "des livres (books) - plural",
        "des pommes (apples) - plural"
      ]
    },
    {
      "title": "Partitive Articles",
      "content": "Partitive articles (du, de la, de l', des) are used with uncountable nouns to express an unspecified quantity. They are often translated as 'some' or 'any' in English.",
      "examples": [
        "du pain (some bread) - masculine",
        "de la soupe (some soup) - feminine",
        "de l'eau (some water) - starts with vowel",
        "des fruits (some fruit) - plural"
      ]
    },
    {
      "title": "Negation with Articles",
      "content": "With negation, definite and indefinite articles change to de or d'. The partitive article also becomes de or d'.",
      "examples": [
        "Je vois le chat → Je ne vois pas le chat (I see the cat → I don't see the cat) - definite stays",
        "J'ai un livre → Je n'ai pas de livre (I have a book → I don't have a book) - un/une becomes de",
        "Je veux du pain → Je ne veux pas de pain (I want some bread → I don't want any bread) - partitive becomes de"
      ]
    },
    {
      "title": "Contractions with À and De",
      "content": "Definite articles contract with à and de: à + le = au, à + les = aux, de + le = du, de + les = des.",
      "examples": [
        "Je vais au marché (I go to the market) - à + le",
        "Je parle aux enfants (I speak to the children) - à + les",
        "Je reviens du cinéma (I come back from the cinema) - de + le",
        "Je reviens des États-Unis (I come back from the United States) - de + les"
      ]
    },
    {
      "title": "Practice Exercise",
      "content": "Write 20 sentences using different articles. Include examples of definite, indefinite, partitive articles, and their use in negation and contractions."
    }
  ]
}
